doc_id,text,title,poet
kpoem_0000,"죽는 날까지 하늘을 우러러 한 점 부끄럼이 없기를, 잎새에 이는 바람에도 나는 괴로워했다. 별을 노래하는 마음으로 모든 죽어가는 것을 사랑해야지 그리고 나한테 주어진 길을 걸어가야겠다. 오늘 밤에도 별이 바람에 스치운다.",서시,윤동주
kpoem_0001,산모퉁이를 돌아 논가 외딴 우물을 홀로 찾아가선 가만히 들여다봅니다. 우물 속에는 달이 밝고 구름이 흐르고 하늘이 펼치고 파아란 바람이 불고 가을이 있습니다. 그리고 한 사나이가 있습니다. 어쩐지 그 사나이가 미워져 돌아갑니다. 돌아가다 생각하니 그 사나이가 가엾어집니다. 도로 가 들여다보니 사나이는 그대로 있습니다. 다시 그 사나이가 미워져 돌아갑니다. 돌아가다 생각하니 그 사나이가 그리워집니다. 우물 속에는 달이 밝고 구름이 흐르고 하늘이 펼치고 파아란 바람이 불고 가을이 있고 추억처럼 사나이가 있습니다.,자화상,윤동주
kpoem_0002,쫓아오든 햇빛인데 지금 교회당 꼭대기 십자가에 걸리었습니다. 첨탑(尖塔)이 저렇게도 높은데 어떻게 올라갈 수 있을까요. 종소리도 들려 오지 않는데 휘파람이나 불며 서성거리다가 괴로웠던 사나이 행복한 예수 그리스도에게 처럼 십자가가 허락된다면 모가지를 드리우고 꽃처럼 피어나는 피를 어두워 가는 하늘 밑에 조용히 흘리겠습니다.,십자가,윤동주
kpoem_0003,바람이 어디로부터 불어 와 어디로 불려 가는 것일까 바람이 부는데 내 괴로움에는 이유가 없다. 내 괴로움에는 이유가 없을까 단 한 여자를 사랑한 일도 없다. 시대를 슬퍼한 일도 없다. 바람이 자꼬 부는데 내 발이 반석 우에 섰다. 강물이 자꼬 흐르는데 내 발이 언덕 우에 섰다.,바람이 불어,윤동주
kpoem_0004,고향에 돌아온 날 밤에 내 백골(白骨)이 따라와 한방에 누웠다. 어둔 방은 우주로 통하고 하늘에선가 소리처럼 바람이 불어 온다. 어둠 속에 곱게 풍화작용(風化作用)하는 백골을 들여다보며 눈물짓는 것이 내가 우는 것이냐 백골이 우는 것이냐 아름다운 혼이 우는 것이냐 지조 높은 개는 밤을 새워 어둠을 짖는다. 어둠을 짖는 개는 나를 쫓는 것일 게다. 가자 가자 쫓기우는 사람처럼 가자 백골 몰래 아름다운 또 다른 고향에 가자.,또 다른 고향,윤동주
kpoem_0005,"계절이 지나가는 하늘에는 가을로 가득 차 있습니다. 나는 아무 걱정도 없이 가을 속의 별들을 다 헤일 듯합니다... 가슴 속에 하나 둘 새겨지는 별을 이제 다 못 헤는 것은 쉬이 아침이 오는 까닭이요, 내일 밤이 남은 까닭이요, 아직 나의 청춘이 다하지 않은 까닭입니다. 별 하나에 추억과 별 하나에 사랑과 별 하나에 쓸쓸함과 별 하나에 동경과 별 하나에 시와 별 하나에 어머니, 어머니",별 헤는 밤,윤동주
kpoem_0006,"어머님, 나는 별 하나에 아름다운 말 한 마디씩 불러 봅니다. 소학교 때 책상을 같이했던 아이들의 이름과, 패, 경, 옥 이런 이국 소녀들의 이름과, 벌써 아기 어머니 된 계집애들의 이름과, 가난한 이웃 사람들의 이름과, 비둘기, 강아지, 토끼, 노새, 노루, '프랑시스 잠', '라이너 마리아 릴케', 이런 시인의 이름을 불러 봅니다. 이네들은 너무나 멀리 있습니다. 별이 아스라이 멀 듯이, 어머님, 그리고 당신은 멀리 북간도에 계십니다 나는 무엇인지 그리워 이 많은 별빛이 내린 언덕 위에 내 이름자를 써 보고, 흙으로 덮어 버리었습니다. 딴은, 밤을 새워 우는 벌레는 부끄러운 이름을 슬퍼하는 까닭입니다. 그러나 겨울이 지나고 나의 별에도 봄이 오면 무덤 위에 파란 잔디가 피어나듯이 내 이름자 묻힌 언덕 위에도 자랑처럼 풀이 무성할 게외다.",별 헤는 밤,윤동주
kpoem_0007,"살구나무 그늘로 얼굴을 가리고, 병원 뒤뜰에 누워, 젊은 여자가 흰 옷 아래로 하얀 다리를 드러내 놓고 일광욕을 한다. 한나절이 기울도록 가슴을 앓는 다는 이 여자를 찾아오는 이, 나비 한 마리도 없다. 슬프지도 않은 살구나무 가지에는 바람조차 없다. 나도 모를 아픔을 오래 참다 처음으로 이 곳에 찾아 왔다. 그러나 나의 늙은 의사는 젊은이의 병을 모른다. 나한테는 병이 없다고 한다. 이 지나친 시련, 이 지나친 피로, 나는 성내서는 안 된다. 여자는 자리에서 일어나 옷깃을 여미고 화단에서 금잔화 한 포기를 따 가슴에 꽂고 병실 안으로 사라진다. 나는 그 여자의 건강이 ---- 아니 내 건강도 속히 회복되기를 바라며 그가 누웠던 자리에 누워 본다.",병원,윤동주
kpoem_0008,잃어버렸습니다. 무얼 어디다 잃었는지 몰라 두 손의 호주머니를 더듬어 길에 나갑니다. 돌과 돌과 돌이 끝없이 연달아 길은 돌담을 끼고 갑니다. 담은 쇠문을 굳게 담아 길 위에 긴 그림자를 드리우고 길은 아침에서 저녁으로 저녁에서 아침으로 통했습니다. 돌담을 더듬어 눈물짓다 쳐다 보면 하늘은 부끄럽게 푸릅니다. 풀 한 포기 없는 이 길을 걷는 것은 담 저 쪽에 내가 남아 있는 까닭이고 내가 사는 것은 다만 잃은 것을 찾는 까닭입니다. (1941.9.31),길,윤동주
kpoem_0009,"세상으로부터 돌아오듯이 이제 내 좁은방에 돌아와 불을 끄옵니다. 불을 켜 두는 것은 너무나 피로롭은 일이옵니다. 그것은 낮의 연장(延長)이옵기에- 이제 창(窓)을 열어 공기(空氣)를 바꾸어 들여야 할터인데 밖을 가만히 내다 보아야 방(房)안과 같이 어두어 꼭 세상 같은데 비를 맞고 오던 길이 그대로 비속에 젖어 있사옵니다. 하로의 울분을 씻을바 없어 가만히 눈을 감으면 마음속으로 흐르는 소리, 이제, 사상(思想)이 능금처럼 저절로 익어 가옵니다.",돌아와 보는 밤,윤동주
kpoem_0010,내를 건너서 숲으로 고개를 넘어서 마을로 어제도 가고 오늘도 갈 나의 길 새로운 길 민들레가 피고 까치가 날고 아가씨가 지나고 바람이 일고 나의 길은 언제나 새로운 길 오늘도... 내일도 ... 내를 건너서 숲으로 고개를 넘어서 마을로,새로운 길,윤동주
kpoem_0011,"봄날 아침도 아니고 여름, 가을, 겨울, 그런 날 아침도 아닌 아침에 빠알간 꽃이 피어났네, 햇빛이 프른데, 그 전날 밤에 그 전날 밤에 모든것이 마련되었네, 사랑은 뱀과 함께 독(毒)은 어린꽃과 함께.",태초의 아침,윤동주
kpoem_0012,하얗게 눈이 덮이었고 전신주(電信柱)가 잉잉 울어 하나님 말씀이 들려온다. 무슨 계시(啓示)일까. 빨리 봄이 오면 죄(罪)를 짓고 눈이 밝아 이브가 해산(解産)하는 수고를 다하면 무화과(無花果) 잎사귀로 부끄런 데를 가리고 나는 이마에 땀을 흘려야겠다.,또 태초의 아침,윤동주
kpoem_0013,다들 죽어가는 사람들에게 검은 옷을 입히시오. 다들 살아가는 사람들에게 흰 옷을 입히시오. 그리고 한 침실(寢室)에 가지런히 잠을 재우시오 다들 울거들랑 젖을 먹이시오 이제 새벽이 오면 나팔소리 들려 올 게외다.,새벽이 올 때까지,윤동주
kpoem_0014,"거 나를 부르는 것이 누구요. 가랑잎 이파리 푸르러 나오는 그늘인데, 나 아직 여기 호흡이 남아 있소. 한 번도 손들어 보지 못한 나를 손들어 표할 하늘도 없는 나를 어디에 내 한 몸 둘 하늘이 있어 나를 부르는 것이오? 일이 마치고 내 죽는 날 아침에는 서럽지도 않은 가랑잎이 떨어질 텐데…… 나를 부르지 마오.",무서운 시간,윤동주
kpoem_0015,흰 수건이 검은 머리를 두르고 흰 고무신이 거친 발에 걸리우다 흰 저고리 치마가 슬픈 몸집을 가리고 흰 띠가 가는 허리를 질끈 동이다,슬픈 족속,윤동주
kpoem_0016,태양을 사모하는 아이들아 별을 사랑하는 아이들아 밤이 어두웠는데 눈감고 가거라. 가진 바 씨앗을 뿌리면서 가거라. 발부리에 돌이 체이거든 감았던 눈을 와짝 떠라.,눈감고 간다,윤동주
kpoem_0017,호젓한 세기(世紀)의 달을 딿아 알뜻 모를뜻 한데로 거닐과저! 아닌 밤중에 튀기듯이 잠자리를 뛰처 끝없는 광야(廣野)를 홀로 거니는 사람의 심사(心思)는 외로우러니 아─ 이 젊은이는 피라미트처럼 슬프구나,비애,윤동주
kpoem_0018,"식권 하로 세끼(三餐)를준다, 식모 젊은아히들에게. 한때 힌그릇셋을준다, 대동강(大洞江) 물로끄린국, 평안도(平安道) 쌀로지은밥, 조선(朝鮮)의 매운고추장, 식권 우리배를 부르게.",식권,윤동주
kpoem_0019,"늦은봄기다리든 토요일(土曜日)날. 오후(午後) 세시반의 경성(京城)행열차는, 석탄(石炭)연기를 자욱이 품기고, 소리치고 지나가고 한몸을 끟을기에 강(强)하든. 공(뽈)이 자력(磁力)을 잃고 한목음의 물이 불붓는 목을 축이기에 넉넉하다, 젊은 가슴의 피순환(循環)이 잣고, 두 철각(鐵脚)이 늘어진다, 검은 기차(汽車)연기(煙氣)와 함께. 풀은 산(山)이 아지랑 저쪽으로 까라안는다,",오후의 구장,윤동주
kpoem_0020,"청초(淸楚)한 코쓰모쓰는 오직 하나인 나의 아가씨, 달빛이 싸늘히 추운 밤이면 넷 소녀(少女)가 몯견디게 그리워 코쓰모쓰 핀 정원(庭園)으로 찾어간다. 코쓰모쓰는 귀또리 울음에도 수집어지고, 코쓰모쓰 앞에선 나는 어렷을적 처럼 부끄러워 지나니, 내마음은 코쓰모쓰의 마음이오. 코쓰모쓰의 마음은 내마음이다.",코스모스,윤동주
kpoem_0021,함께핀 꽃에 처음익은 능금은 먼저 떨어젓슴니다. 오날도 가을바람은 그냥붐니다. 길가에 떨어진 불근 능금은 지나든 손님이 집어갓슴니다.,그 여자,윤동주
kpoem_0022,헌집신짝 끟을고 나여긔 웨왓노 두만강을 건너서 쓸쓸한 이 땅에 남쪽하늘 저밑엔 따뜻한 내고향 내어머니 게신곧 그리운 고향집.,고향집,윤동주
kpoem_0023,"「이 개 더럽잔니」 아─ 니 이웃집 덜렁 숳개가 오날 어슬렁 어슬렁 우리집으로 오더니 우리집 바두기의 미구멍에다 코를대고 씩々 내를 맛겟지 더러운줄도 모르고, 보기 숭해서 막차며 욕해 쫓앗더니 꼬리를 휘휘 저으며 너희들보다 어떻겟냐하는 상으로 뛰여가겟지요 나─ 참.",개,윤동주
kpoem_0024,"나무가 춤을 추면 바람이 불고, 나무가 잠잠하면 바람도 자오,",나무,윤동주
kpoem_0025,왜떡이 씁은 데도 작고 달다고 하오.,할아버지,윤동주
kpoem_0026,"앙당한 솔나무가지에, 훈훈한 바람의 날개가 스치고 얼음 석긴 대동강(大洞江)물에, 한나절 햇발이 밋그러지다, 허무러진 성터(城터)에서 철모르는 여자(女兒)들이 저도 모를 이국(異國)말로, 재질대며 뜀을 뛰고. 난데없는 자동차(自動車)가 밉다.",모란봉에서,윤동주
kpoem_0027,"눈이 오다, 물이 되는 날. 재ㅅ빛 하늘에 또 뿌연 내, 그리고, 크다란 기관차(機關車)는 빼─액─ 울며, 쪽그만, 가슴은, 울렁거린다. 리별이 너무 재빠르다, 안탑갑게도, 사랑하는 사람을, 일터에서 만나자 하고─. 더운 손의 맛과, 구슬눈물이 마르기 전 기차는 꼬리를 산굽으로 돌렷다,",이별,윤동주
kpoem_0028,"종달새는 일은봄날 즐드즌 거리의뒷골목이 슳더라. 명량한 봄하늘, 가벼운 두나래를펴서 요염한 봄노래가, 좋더라, 그러나, 오날도 구멍뚤린 구두를끌고, 훌렁훌렁 뒷거리길로, 고기색기같은나는 헤매나니, 나래와노래가 없음인가, 가슴이 답답하구나,",종달새,윤동주
kpoem_0029,공상(空想)─ 내마음의 탑(塔) 나는 말없이 이탑(塔)을 쌓고있다 명예(名譽)와 허영(虛榮)의 천공(天空)에다 문허질줄도 몰으고 한층두층 높이 싸ㅅ는다 무한(無限)한 나의 공상(空想)─ 그것은 내마음의 바다 나는 두팔을 펄처서 나의 바다에서 자유(自由)로히 헤염친다 황금(黃金) 지욕(知慾)의 수평선(水平線)을 향(向)하여.,공상,윤동주
kpoem_0030,"래일래일 하기에 물엇더니. 밤을자고 동틀때 래일이라고. 새날을 찯은나는 잠을자고 돌보니. 그때는 내일이아니라. 오늘이더라, 무리여! 래일은 없나니 …………",내일은 없다,윤동주
kpoem_0031,"산들이 두 줄로 줄다를질 치고 여울이 소리처 목이 자젓다. 한여름의 햇님이 구름을 타고 이골작이를 빠르게도 건너련다. 산(山)등아리에 송아지 뿔처럼 울뚝불뚝히 어린 바위가 솟구, 얼룩소의 보드러운 털이 산(山)등서리에 퍼─렇게 자랏다. 삼년(三年)만에 고향(故鄕) 찾어드는 산꼴 나그네의 발거름이 타박타박 땅을 고눈다. 벌거숭이 두루미 다리같이... 헌 신짝이 집행이 끝에 목아지를 매달아 늘어지고, 까치가 색기의 날발을 태우려 날뿐, 골작은 나그네의 마음처럼 고요하다.",곡간,윤동주
kpoem_0032,"장미 병들어 옮겨 놓을 이웃이 없도다. 달랑달랑 외로히 황마차(幌馬車) 태워 산(山)에 보낼거나, 뚜— 구슬피 화륜선(火輪船) 태워 대양(大洋)에 보낼거나, 프로펠러 소리 요란히 비행기(飛行機) 태워 성층권(成層圈)에 보낼거나 이것 저것 다 구만두고 자라가는 아들이 꿈을 깨기 전 이내 가슴에 묻어다오.",장미 병들어,윤동주
kpoem_0033,"황혼(黃昏)이 짙어지는 길모퉁이에서 하루종일 시들은 귀를 가만히 기울이면 땅거미 옮겨지는 발자취 소리, 발자취 소리를 들을 수 있도록 나는 총명했든가요. 이제 어리석게도 모든 것을 깨달은 다음 오래 마음 깊은 속에 괴로워하던 수많은 나를 하나, 둘 제고장으로 돌려보내면 거리모퉁이 어둠 속으로 소리 없이 사라지는 흰 그림자, 흰 그림자들 연연히 사랑하던 흰 그림자들, 내 모든 것을 돌려 보낸 뒤 허전히 뒷골목을 돌아 황혼(黃昏)처럼 물드는 내 방으로 돌아오면 신념(信念)이 깊은 의젓한 양(羊)처럼 하루종일 시름없이 풀포기나 뜯자.",흰 그림자,윤동주
kpoem_0034,"봄이 오던 아침, 서울 어느 쪼그만 정거장(停車場)에서 희망(希望)과 사랑처럼 기차(汽車)를 기다려, 나는 플랫폼(푸라트•폼)에 간신한 그림자를 떨어트리고, 담배를 피웠다. 내 그림자는 담배연기 그림자를 날리고 비둘기 한 떼가 부끄러울 것도 없이 나래 속을 속, 속, 햇빛에 비춰, 날았다. 기차(汽車)는 아무 새로운 소식도 없이 나를 멀리 실어다 주어, 봄은 다 가고—— 도쿄(東京) 교외(郊外) 어느 조용한 하숙방(下宿房)에서, 옛 거리에 남은 나를 희망(希望)과 사랑처럼 그리워한다. 오늘도 기차(汽車)는 몇 번이나 무의미(無意味)하게 지나가고, 오늘도 나는 누구를 기다려 정거장(停車場) 가까운 언덕에서 서성거릴게다. ——아아 젊음은 오래 거기 남아 있거라.",사랑스런 추억,윤동주
kpoem_0035,"으스럼히 안개가 흐른다. 거리가 흘러간다. 저 전차(電車), 자동차(自動車), 모든 바퀴가 어디로 흘리워 가는 것일까? 정박(定泊)할 아무 항구(港口)도 없이, 가련한 많은 사람들을 실고서, 안개 속에 잠긴 거리는, 거리 모통이 붉은 포스트상자를 붙잡고 섰을라면 모든 것이 흐르는 속에 어렴풋이 빛나는 가로등(街路燈), 꺼지지 않는 것은 무슨 상징(象徵)일까? 사랑하는 동무 박(朴)이여! 그리고 김(金)이여! 자네들은 지금 어디 있는가? 끝없이 안개가 흐르는데, 「새로운 날 아침 우리 다시 정(情)답게 손목을 잡어 보세」 몇 자 적어 포스트 속에 떨어트리고, 밤을 새워 기다리면 금휘장(金徽章)에 금단추(金단추)를 삐었고 거인(巨人)처럼 찬란히 나타나는 배달부(配達夫), 아침과 함께 즐거운 내림(來臨), 이밤을 하염없이 안개가 흐른다.",흐르는 거리,윤동주
kpoem_0036,"창밖(窓外)에 밤비가 속살거려 육첩방(六疊房)은 남의 나라, 시인(詩人)이란 슬픈 천명(天命)인줄 알면서도 한줄 시(詩)를 적어 볼가, 땀내와 사랑내 포근히 품긴 보내주신 학비봉투(學費封套)를 받어 대학(大學)노—트를 끼고 늙은 교수(敎授)의 강의(講義) 들으려 간다. 생각해 보면 어린때 동무를 하나, 둘, 죄다 잃어 버리고 나는 무얼 바라 나는 다만, 홀로 침전(沈澱)하는 것일가? 인생(人生)은 살기 어렵다는데 시(詩)가 이렇게 쉽게 씨워지는 것은 부끄러운 일이다. 육첩방(六疊房)은 남의 나라 창밖(窓外)에 밤비가 속살거리는데, 등불을 밝혀 어둠을 조곰 내몰고, 시대(時代)처럼 올 아침을 기다리는 최후(最後)의 나, 나는 나에게 적은 손을 내밀어 눈물과 위안(慰安)으로 잡는 최초(最初)의 악수(握手).",쉽게 쓰여진 시,윤동주
kpoem_0037,"봄이 혈관(血管)속에 시내처럼 흘러 돌, 돌, 시내가 차운 언덕에 개나리, 진달래, 노오란 배추꽃 삼동(三冬)을 참어온 나는 풀포기처럼 피어난다. 즐거운 종달새야 어느 이랑에서 즐거웁게 솟쳐라. 푸르른 하늘은 아른아른 높기도 한데……",봄,윤동주
kpoem_0038,파란 녹이 낀 구리거울 속에 내 얼굴이 남어 있는 것은 어느 왕조(王朝)의 유물(遺物)이기에 이다지도 욕될가 나는 나의 참회(懺悔)의 글을 한줄에 주리자 ——만(滿) 이십사 년 일 개월(一個月)을 무슨 기쁨을 바라 살아 왔든가 내일이나 모레나 그 어느 즐거운 날에 나는 또 한줄의 참회록(懺悔錄)을 써야한다. ——그때 그 젊은 나이에 왜 그런 부끄런 고백(告白)을 했든가 밤이면 밤마다 나의 거울을 손바닥으로 발바닥으로 닦어 보자. 그러면 어느 운석(隕石) 밑으로 흘러 걸어가는 슬픈 사람의 뒷모양이 거울 속에 나타나온다.,참회록,윤동주
kpoem_0039,"바닷가 햇빛 바른 바위우에 습한 간(肝)을 펴서 말리우자, 코카사쓰 산중(山中)에서 도망해온 토끼처럼 둘러리를 빙빙 돌며 간(肝)을 지키자, 내가 오래 기르든 여윈 독수리야! 와서 뜯어 먹어라, 시름없이 너는 살지고 나는 여위여야지, 그러나, 거북이야! 다시는 용궁(龍宮)의 유혹(誘惑)에 안떨어진다. 푸로메디어쓰 불상한 푸로메디어쓰 불 도적한 죄로 목에 맷돌을 달고 끝없이 침전(沈澱)하는 푸로메디어쓰,",간,윤동주
kpoem_0040,연륜(年輪)이 자라듯이 달이 자라는 고요한 밤에 달같이 외로운 사랑이 가슴하나 뻐근히 연륜(年輪)처럼 피어나간다.,달같이,윤동주
kpoem_0041,"시들은 잎새속에서 고 빨간 살을 드러내 놓고, 고추는 방년(芳年)된 아가씬양 땡볕에 자꾸 익어간다. 할머니는 바구니를 들고 밭머리에서 어정거리고 손가락 너어는 아이는 할머니 뒤만 따른다.",고추 밭,윤동주
kpoem_0042,붉은 이마에 싸늘한 달이 서리어 아우의 얼굴은 슬픈 그림이다. 발걸음을 멈추어 살그머니 애딘 손을 잡으며 「늬는 자라 무엇이 되려니」 「사람이 되지」 아우의 설은 진정코 설은 대답(對答)이다. 슬며시 잡았든 손을 놓고 아우의 얼골을 다시 들여다 본다. 싸늘한 달이 붉은 이마에 젖어 아우의 얼골은 슬픈 그림이다.,아우의 인상화,윤동주
kpoem_0043,순(順)아 너는 내 전(殿)에 언제 들어왔든 것이냐? 내사 언제 네 전(殿)에 들어갔든 것이냐? 우리들의 전당(殿堂)은 고풍(古風)한 풍습(風習)이 어린 사랑의 전당(殿堂) 순(順)아 암사슴처럼 수정(水晶)눈을 나려감어라. 난 사자처럼 엉크린 머리를 고루련다. 우리들의 사랑은 한낱 벙어리이었다. 성(聖)스런 촛대에 열(熱)한 불이 꺼지기 전(前) 순(順)아 너는 앞문으로 내 달려라. 어둠과 바람이 우리 창(窓)에 부닥치기 전(前) 나는 영원(永遠)한 사랑을 안은채 뒷문으로 멀리 사라지련다. 이제 네게는 삼림(森林)속의 아늑한 호수(湖水)가 있고 내게는 준험(峻嶮)한 산맥(山脈)이 있다.,사랑의 전당,윤동주
kpoem_0044,"발에 터부한 것을 다 빼어 바리고 황혼(黃昏)이 호수(湖水)우로 걸어 오듯이 나도 삽분삽분 걸어 보리이까? 내사 이 호수(湖水)가로 부르는 이 없이 불리워 온 것은 참말 이적(異蹟)이외다. 오늘 따라 연정(戀情), 자부(自惚), 시기(猜忌), 이것들이 자꾸 금메달(金메달)처럼 만져지는구려 하나, 내 모든 것을 여념(餘念)없이 물결에 씻어 보내려니 당신은 호면(湖面)으로 나를 불러 내소서.",이적,윤동주
kpoem_0045,"솨— 철석! 파도소리 문살에 부서져 잠 살포시 꿈이 흐터진다. 잠은 한낱 검은 고래떼처럼 살래어, 달랠 아무런 재주도 없다. 불을 밝혀 잠옷을 정성스리 여미는 삼경(三更). 염원(念願). 동경(憧憬)의 땅 강남(江南)에 또 홍수(洪水)질 것만 싶어, 바다의 향수(鄕愁)보다 더 호젓해진다.",비오는 밤,윤동주
kpoem_0046,"괴로운 사람아 괴로운 사람아 옷자락 물결속에서도 가슴속 깊이 돌돌 샘물이 홀러 이밤을 더부러 말할이 없도다. 거리의 소음과 노래 부를수 없도다. 그신듯이 냇가에 앉았으니 사랑과 일을 거리에 매끼고 가만히 가만히 바다로 가자, 바다로 가자,",산골물,윤동주
kpoem_0047,후어—ㄴ한 방(房)에 유언(遺言)은 소리 없는 입놀림. 바다에 진주(眞珠) 캐려 갔다는 아들 해녀(海女)와 사랑을 속삭인다는 맏아들 이 밤에사 돌아오나 내다 봐라—— 평생(平生) 외롭던 아버지의 운명(殞命) 감기우는 눈에 슬픔이 어린다. 외딴집에 개가 짖고 휘영찬 달이 문살에 흐르는 밤.,유언,윤동주
kpoem_0048,"쉬는 시간(時間)마다 나는 창옆(窓옄)으로 갑니다. ——창(窓)은 산 가르침. 이글이글 불을 피워주소, 이 방에 찬것이 서립니다. 단풍잎 하나 맴 도나 보니 아마도 작으마한 선풍(旋風)이 인게웨다. 그래도 싸느란 유리창에 햇살이 쨍쨍한 무렵, 상학종(上學鐘)이 울어만 싶습니다.",창,윤동주
kpoem_0049,"실어다 뿌리는 바람조차 시원타. 솔나무 가지마다 샛춤히 고개를 돌리어 뻐들어지고, 밀치고 밀치운다. 이랑을 넘는 물결은 폭포처럼 피어오른다. 해변(海邊)에 아이들이 모인다 찰찰 손을 씻고 구보로. 바다는 자꾸 섧어진다. 갈매기의 노래에……… 돌아다 보고 돌아다 보고 돌아가는 오늘의 바다여!",바다,윤동주
kpoem_0050,내 노래는 오히려 섧은 산울림. 골자기 길에 떨어진 그림자는 너무나 슬프구나. 오후(午後)의 명상(瞑想)은 아— 졸려.,산협의 오후,윤동주
kpoem_0051,"가츨가츨한 머리칼은 오막사리 처마끝, 쉬파람에 콧마루가 서운한 양 간질키오. 들창(窓) 같은 눈은 가볍게 닫혀 이 밤에 연정(戀情)은 어둠처럼 골골히 스며드오.",명상,윤동주
kpoem_0052,"싸늘한 대리석(大理石) 기둥에 목아지를 비틀어맨 한난계(寒暖計), 문득 들여다 볼 수 있는 운명(運命)한 오척육촌(五尺六寸)의 허리 가는 수은주(水銀柱), 마음은 유리관(琉璃管)보다 맑소이다. 혈관(血管)이 단조(單調)로워 신경질(神經質)인 여론동물(輿論動物), 가끔 분수(噴水) 같은 냉침(冷침)을 억지로 삼키기에 정력(精力)을 낭비(浪費)합니다. 영하(零下)로 손구락질 할 수도 없는 방(房)처럼 치운 겨울보다 해바라기 만발(滿發)한 팔월(八月) 교정(校庭)이 이상(理想)곱소이다. 피끓을 그날이—— 어제는 막 소낙비가 퍼붓더니 오늘은 좋은 날세올시다. 동저고리 바람에 언덕으로, 숲으로 하시구려—— 이렇게 가만 가만 혼자서 귓속이야기를 하였읍니다. 나는 또 내가 모르는 사이에—— 나는 아마도 진실(眞實)한 세기(世紀)의 계절(季節)을 따라—— 하늘만 보이는 울타리 안을 뛰쳐, 역사(歷史) 같은 포지슌을 지켜야 봅니다.",한란계,윤동주
kpoem_0053,"번개, 뇌성, 왁자지근 뚜다려 머—ㄴ 도회지(都會地)에 낙뢰(落雷)가 있어만 싶다. 벼루짱 엎어논 하늘로 살같은 비가 살처럼 쏟아진다. 손바닥만한 나의 정원(庭園)이 마음같이 흐린 호수(湖水)되기 일수다. 바람이 팽이처럼 돈다. 나무가 머리를 이루 잡지 못한다. 내 경건(敬虔)한 마음을 모셔드려 노아때 하늘을 한 모금 마시다.",소낙비,윤동주
