doc_id,text,title,poet
kpoem_0446,그대가 평양서 울고 있을 때 나는 서울있어 노래 불렀네 인생은 물과 구름 구름이라고 노래 노래 부르며 탄식하였네 홍릉(洪陵)에 넓은 동산 풀이마르고 고향의 강두덕에 자개 널리니 지금은 속속들이 생각이 나며 그대 그대 부르며 나는 우노라 그대는 오늘날에 떠도는 계집 인생은 물과 구름 구름일러라 쳐다보니 가을의 느린 하루는 산 건너 저기 저편 해가 지누나,불칭추평,김소월
kpoem_0447,삼수갑산(三水甲山) 내 왜 왔노 삼수갑산이 어디뇨 오고나니 기험(寄險)타 아하 물도 많고 산첩첩(山疊疊)이라 아하하 내 고향을 도로 가자 내 고향을 내 못 가네 삼수갑산 멀드라 아하 촉도지난(蜀道之難)이 예로구나 아하하 삼수갑산이 어디뇨 내가 오고 내 못 가네 불귀(不歸)로다 내 고향 아하 새가 되면 떠가리라 아하하 님 계신 곳 내 고향을 내 못 가네 내 못 가네 오다 가다 야속타 아하 삼수갑산이 날 가두었네 아하하 내 고향을 가고지고 오호 삼수갑산 날 가두었네 불귀로다 내 몸이야 아하 삼수갑산 못 벗어난다 아하하,삼수갑산 - 차안서삼갑산운,김소월
kpoem_0448,금년도 한해는 어디 갔노 두는데 없건만 가는 세월 온나는 새해는 어디 오노 값없이 덧없이 나이 한 걷는 길 같으면 돌아가리 겉는 길 같으면 쉬어가리 깨었을 말로는 자도 보리 꿈이라고 하면 깨어 보리 모르는 글자는 아니지만 감았던 마음만 이즈러지네 못 먹는 술이나 아니언만 간다사 원마다 술값 있네,세모감,김소월
kpoem_0449,공중(空中)에 떠다니는 저기 저 새여 네 몸에는 털 있고 깃이 있지. 밭에는 밭곡식 논에는 물벼 눌하게 익어서 수그러졌네. 초산(楚山) 지나 적유령(狄踰嶺) 넘어선다. 짐 실은 저 나귀는 너 왜 넘니?,옷과 밥과 자유,김소월
kpoem_0450,밤에는 밤마다 자리를 펴고 누워서 당신을 그리워하고. 잘근잘근 이불깃 깨물어 가며 누워서 당신을 그리워하고. 다 말고 후닥닥 떨치고 나자 금시로 가보고 말 노릇이지. 가보고 말아도 좋으련만 여보 당신도 생각을 하우 가자 가자 못 가는 몸이라우. 내일 모레는 일요일 일요일은 노는 날. 노는 날 닥치면 두루 두루루 자전거 타고서 가리다. 뒷산의 솔숲에 우는 새도 당신의 집 뒷문 새라지요. 새소리 뻐꾹 뻐꾹 뻐꾹 여기서 뻐꾹 저기서 뻐꾹. 낮에는 갔다가 밤에는 와 울면 당신이 날 그리는 소리라지요. 내일 모레는 일요일 두루두루 두루루 자전거 타고서 가리다.,자전거,김소월
kpoem_0451,"튼튼한 몸이라고 몹시 쓸 줄 또 있으랴 쓸레야 안쓰랴만 부질없이 안 쓸 것이 늘 써야 하는 이 몸이 한평생인가 합니다. 물보다 무흠튼 몸 진흙 외려 탓이 없다. 불보다 밝는지 해거멍만도 못하여라 바람같이 활발턴 기개 망두석 부끄러 합니다. 자는 잠, 잠 아니라 귀신 사람 그 새외다, 먹는 밥, 밤 아니라 흙을 씹는 맛이외다, 게다가 하는 생각이라고 먹물인 듯합니다. 죽자면 모르지만 명(命)아닌데 죽을 것가 살자면 사는 동안 몸부터 튼튼코야 튼튼치 못한 몸을 튼튼히 쓰랴 합니다. 질기다면 질긴 것이 사람 몸엔 우없어리. 할다가 마구 쓰면 질긴 것은 어디 있노 하여튼 방금에 괴로운 몸을 서러합니다.",절제,김소월
kpoem_0452,아까부터 노을은 오고 있었다. 내가 만약 달이 된다면 지금 그 사람의 창가에도 아마 몇 줄기는 내려지겠지. 사랑하기 위하여 서로를 사랑하기 위하여 숲속의 외딴집 하나 거기 초록 빛 위 구구구 비둘기 산다. 이제 막 장미가 시들고 다시 무슨 꽃이 피려한다. 아까부터 노을은 오고 있었다. 산 너머 갈매 하늘이 호수에 가득 담기고 아까부터 노을은 오고 있었다.,첫사랑,김소월
kpoem_0453,"속잎 푸른 고운 잔디 소리라도 내려는 듯, 쟁쟁하신 고운 햇볕 눈 뜨기에 바드랍네. 자주 드린 적은 꽃과 느란 물든 산국화엔, 달고 옅은 인새 흘러 나뷔 벌이 잠 새우네. 복사나무 살구나무 불그스레 취하였고, 개창버들 파란 가지 길게 늘여 어리이네. 일에 갔던 팔린 소는 서런 듯이 길게 울고, 모를 시름 좇던 개는 다리 뻗고 하품하네 청초청초 우거진 곳 송이송이 붉은 꽃숲 꿈같이 그 우리 님과 손목 잡고 놀던 델세.",춘강,김소월
kpoem_0454,첫날에 길동무 만나기 쉬운가 가다가 만나서 길동무 되지요. 날끊다 말어라 가장(家長)님만 님이랴 오다가다 만나도 정붙으면 님이지. 화문석(花紋席) 돗자리 놋촉대(燭臺) 그늘엔 칠십년(七十年) 고락(苦樂)을 다짐둔 팔벼개. 드나는 곁방의 미닫이 소리라 우리는 하루밤 빌어얻은 팔벼개. 조선(朝鮮)의 강산(江山)아 네가 그리 좁더냐 삼천리(三千里) 서도(西道)를 끝까지 왔노라. 삼천리(三千里) 서도(西道)를 내가 여기 왜 왔나 남포(南浦)의 사공님 날 실어다 주었소.,팔벼개 노래,김소월
kpoem_0455,집 뒷산(山) 솔밭에 버섯 따던 동무야 어느 뉘집 가문(家門)에 시집 가서 사느냐. 영남(嶺南)의 진주(晉州)는 자라난 내 고향(故鄕) 부모(父母)없는 고향(故鄕)이라우. 오늘은 하루밤 단잠의 팔벼개 내일(來日)은 상사(想思)의 거문고 벼개라. 첫닭아 꼬꾸요 목놓지 말아라 품 속에 있던 님 길차비 차릴라. 두루두로 살펴도 금강(金剛) 단발령(斷髮令) 고개길도 없는몸 나는 어찌 하라우. 영남(嶺南)의 진주(晉州)는 자라난 내 고향(故鄕) 돌아갈 고향(故鄕)은 우리 님의 팔벼개.,팔벼개 노래,김소월
kpoem_0456,"흘러가는 물이라 맘이 물이면 옛날에 곱던 그대 나를 향하여 구엽은 그 잘못을 이르러느냐. 모두 다 지어 묻은 나의 지금은 그대를 불신만 전 다 잊었노라. 당연히 이미 잊고 바렸을러라. 그러나 그 당시에 나는 얼마나 앉았다 일어섰다 설워 울었노, 그 연갑(年甲)의 젊은이 길에 어려도 뜬 눈으로 새벽을 잠에 달려도 남들은 좋은 운수 가끔 볼 때도 얼없이 오다 가다 멈칫 섰어도. 자애의 차부 없는 복도 빌며 덧있는 삶이라 쓴 세상이라 슬퍼도 하였지만 맘이 물이라 저절로 차츰 잊고 말았었노라.",흘러가는 물이라 맘이 물이면,김소월
kpoem_0457,1 딸기 딸기 명주 딸기 집집이 다 자란 맏딸아기 딸기 딸기는 다 익었네 내일은 열하루 시집갈 날 일모창산 날 저문다 월출동정에 달이 솟네 오호로 배 띄어라 범녀도 님 싣고 떠나간 길 노던 벌에 오는 비는 숙낭자의 눈물이라 어얼시구 밤이 간다 내일은 열하루 시집갈 날 2 휜 꽃 흰 꽃 흰 나비와 흰 이마 흰 눈물 검은 머리 흰 꽃 흰 꽃 나붓는데 흰 이마 흰 눈물 검은 머리. 3 산에서 보면 바다가 좋고 바다에서는 산이 좋고 온 데 간 데 다 좋아도 어디다 내 집을 지어둘고. 4 있다고 있는 척 못할 일이 없다고 부러워 안 할 일이 세상에 못난 이 없는 것이 저 잘난 성수에 살아보리. 5 죽어간 님을 님이래랴 뚫어진 신짝을 신이래랴. 앞 남산에 불탄 등걸 잎 피던 자국에 좀이 드네.,항전애창 명주딸기,김소월
kpoem_0458,"오오, 내 님이여? 당신이 내게 주시려고 간 곳마다 이 자리를 깔아 놓아 두시지 않으셨어요. 그렇겠어요 확실히 그러신 줄을 알겠어요. 간 곳마다 저는 당신이 펴 놓아 주신 이 자리 속에서 항상 살게 되므로 당신이 미리 그러신 줄을 제가 알았어요. 오오 내 님이여! 당신이 깔아 놓아 주신 이 자리는 맑은 못 밑과 같이 고조곤도 하고 아늑도 했어요. 홈싹홈싹 숨치우는 보드라운 모래 바닥과 같은 긴 길이, 항상 외롭고 힘없는 저의 발길을 그리운 당신한테로 인도하여 주겠지요. 그러나 내 님이여! 밤은 어둡구요 찬바람도 불겠지요. 닭은 울었어도 여태도록 빛나는 새벽은 오지 않겠지요. 오오 제 몸에 힘 되시는 내 그리운 님이여! 외롭고 힘없는 저를 부둥켜안으시고 영원히 당신의 믿음성스러운 그 품속에서 저를 잠들게 하여 주셔요.",꿈자리,김소월
kpoem_0459,"당신이 깔아 놓아 주신 이 자리는 외롭고 쓸쓸합니다마는, 제가 이 자리 속에서 잠자고 놀고 당신만을 생각할 그때에는 아무러한 두려움도 없고 괴로움도 잊어버려지고 마는데요. 그러면 님이여! 저는 이 자리에서 종신토록 살겠어요. 오오 내 님이여! 당신은 하루라도 저를 이 세상에 더 묵게 하시려고 이 자리를 간 곳마다 깔아 놓아 두셨어요. 집 없고 고단한 제 몸의 종적을 불쌍히 생각하셔서 검소한 이 자리를 간 곳마다 제 소유로 장만하여 주셨어요. 그리고 또 당신은 제 엷은 목숨의 줄을 온전히 붙잡아 주시고 외로이 일생을 제가 위험 없는 이 자리 속에 살게 하여 주셨어요. 오오 그러면 내 님이여! 끝끝내 저를 이 자리 속에 두어 주셔요. 당신이 손수 당신의 그 힘 되고 믿음성부른 품 속에다 고요히 저를 잠들려 주시고 저를 또 이 자리 속에 당신이 손수 묻어 주셔요.",꿈자리,김소월
kpoem_0460,"정거장 플랫포옴에 내렸을 때, 아무도 없어 다들 손님들뿐. 손님 같은 사람들뿐. 집집마다 간판이 없어 집 찾을 근심이 없어. 빨갛게, 파랗게, 불붙는 문자도 없이 모퉁이마다 자애로운 헌 와사등에 불을 켜놓고, 손목을 잡으면 다들, 어진 사람들. 다들, 어진 사람들. 봄, 여름, 가을, 겨울 순서로 돌아들고.",간판 없는 거리,윤동주
kpoem_0461,"머리에 푸로페라가, 연자깐 풍채보다, 더─ 빨리돈다. 따에서 오를때보다 하늘에 높히떠서는 빠르지 몯하다 숨결이 찬모양이야. 비행긔는─ 새처럼 나래를 펄럭거리지 몯한다 그리고, 늘.─ 소리를 지른다. 숨이찬가바.",비행기,윤동주
kpoem_0462,"붉은사과 한개를 아버지 어머니 누나, 나, 넷이서 껍질채로 송치까지 다─ 논아먹엇소.",사과,윤동주
kpoem_0463,"─닭은 나래가커두 웨, 날잖나요 ─아마 두엄파기에 홀, 잊엇나봐.",닭,윤동주
kpoem_0464,"눈이 샛하야케 와서, 눈이 새물새물 하오.",눈,윤동주
kpoem_0465,"만돌이가 학교에서 돌아오다가 전보대 있는데서 돌재기 다섯개를 주었습니다. 전보대를 겨누고 돌첫개를 뿌렷습니다. —딱— 두개채 뿌렷습니다. —아불사— 세개채 뿌렷습니다. —딱— 네개채 뿌렷습니다. —아불사— 다섯개채 뿌렷습니다. —딱— 다섯개에 세개…… 그만하면 되엿다. 내일 시험, 다섯문데에 세문데만하면— 손꼽아 구구를 하여봐도 허양 륙심점이다. 볼거있나 공차려가자. 그이튼날 만돌이는 꼼짝몯하고 선생님한테 힌종이를 바처슬까요. 그렇찬으면 정말 륙심점을 맞엇슬까요",만돌이,윤동주
kpoem_0466,구즌비 나리는 가을밤 벌거숭이 그대로 잠자리에서 뜇여나와 마루에 쭈구리고 서서 아이ㄴ양 하고 솨─오좀을 쏘오.,가을밤,윤동주
kpoem_0467,"엻을것없서, 걱정이든, 후주머니는, 겨을만 되면 주먹두개 갑북 갑북.",호주머니,윤동주
kpoem_0468,거미란 놈이 흉한 심보로 병원(病院) 뒷뜰 난간과 꽃밭사이 사람발이 잘 닿지 않는 곳에 그물을 쳐 놓았다. 옥외요양(屋外療養)을 받는 젊은 사나이가 누어서 치어다 보기 바르게—— 나비가 한마리 꽃밭에 날아 들다 그물에 걸리었다. 노—란 날개를 파득거려도 파득거려도 나비는 자꾸 감기우기만 한다. 거미가 쏜살같이 가더니 끝없는 끝없는 실을 뽑아 나비의 온몸을 감아 버린다. 사나이는 긴 한숨을 쉬었다. 나이 보담 무수한 고생끝에 때를 잃고 병(病)을 얻은 이 사나이를 위로(慰勞)할 말이——거미줄을 헝클어 버리는 것밖에 위로(慰勞)의 말이 없었다.,위로,윤동주
kpoem_0469,슬퍼 하는자는 복이 있나니 슬퍼 하는자는 복이 있나니 슬퍼 하는자는 복이 있나니 슬퍼 하는자는 복이 있나니 슬퍼 하는자는 복이 있나니 슬퍼 하는자는 복이 있나니 슬퍼 하는자는 복이 있나니 슬퍼 하는자는 복이 있나니 저희가 영원(永遠)히 슬플 것이오.,팔복,윤동주
kpoem_0470,"하나, 둘, 셋, 네 …………………… 밤은 많기도 하다.",못자는 밤,윤동주
kpoem_0471,만상(萬象)을 굽어 보기란—— 무릎이 오들오들 떨린다. 백화(白樺) 어려서 늙었다. 새가 나비가 된다. 정말 구름이 비가 된다. 옷 자락이 칩다.,비로봉,윤동주
kpoem_0472,"햇살은 미닫이 틈으로 길죽한 일자(一字)를 쓰고…… 지우고…… 까마귀떼 지붕 우으로 둘, 둘, 셋, 넷, 자꼬 날아 지난다. 쑥쑥, 꿈틀꿈틀 북(北)쪽 하늘로, 내사……… 북(北)쪽 하늘에 나래를 펴고 싶다.",황혼,윤동주
kpoem_0473,제비는 두 나래를 가지었다. 시산한 가을날—— 어머니의 젖가슴이 그리운 서리 나리는 저녁—— 어린 영(靈)은 쪽나래의 향수(鄕愁)를 타고 남(南)쪽 하늘에 떠 돌뿐——,남쪽 하늘,윤동주
kpoem_0474,"달밤의 거리 선풍(旋風)이 휘날리는 북극(北國)의 거리 도시(都市)의 진주(眞珠) 전등(電燈)밑을 헤염치는 조그만 인어(人魚) 나, 달과 전등에 비쳐 한몸에 둘셋의 그림자, 커졌다 작아졌다. 괴롬의 거리 회색(灰色)빛 밤거리를 걷고 있는 이 마음 선풍(旋風)이 일고 있네 외로우면서도 한갈피 두갈피 피어나는 마음의 그림자, 푸른 공상(空想)이 높아졌다 낮아졌다.",거리에서,윤동주
kpoem_0475,"손가락에 침발러 쏘옥, 쏙, 쏙. 장에 가는 엄마 내다보려 문풍지를 쏘옥, 쏙, 쏙, 아침에 햇빛이 빤짝, 손가락에 침발러 쏘옥, 쏙, 쏙, 장에 가신 엄마 돌아오나 문풍지를 쏘옥, 쏙, 쏙, 저녁에 바람이 솔솔,",햇빛·바람,윤동주
kpoem_0476,누나! 이 겨을에도 눈이 가득히 왔읍니다. 흰 봉투에 눈을 한줌 넣고 글씨도 쓰지 말고 우표도 붙이지 말고 말숙하게 그대로 편지를 부칠가요? 누나 가신 나라엔 눈이 아니 온다기에.,편지,윤동주
kpoem_0477,"우리 애기는 아래발치에서 코올코올, 고양이는 부뜨막에서 가릉가릉, 애기 바람이 나무가지에서 소올소올, 아저씨 햇님이 하늘한가운데서 째앵째앵.",봄,윤동주
kpoem_0478,"「뾰, 뾰, 뾰 엄마 젖 좀 주」 병아리 소리. 「꺽, 꺽, 꺽, 오냐 좀 기다려」 엄마닭 소리. 좀 있다가 병아리들은 엄마품 속으로 다 들어 갔지요.",병아리,윤동주
kpoem_0479,처마 밑에 시래기 다래미 바삭바삭 추어요. 길바닥에 말똥 동그램이 달랑달랑 얼어요.,겨울,윤동주
kpoem_0480,요오리 조리 베면 저고리 되고 이이렇게 베면 큰 총되지. 누나하고 나하고 가위로 종이 쏠았더니 어머니가 빗자루 들고 누나하나 나하나 엉덩이를 때렸소 방바닥이 어지럽다고—— 아아니 아니 고놈의 빗자루가 방바닥 쓸기 싫으니 그랬지 그랬어 괘씸하여 벽장속에 감췄드니 이튼날 아침 빗자루가 없다고 어머니가 야단이지요.,빗자루,윤동주
kpoem_0481,"나는 고개길을 넘고 있었다…… 그 때 세 소년(少年)거지가 나를 지나쳤다. 첫재 아이는 잔등에 바구니를 둘러메고, 바구니 속에는 사아다병, 간즈메통, 쇳조각, 헌 양말짝등(等) 폐물(廢物)이 가득하였다. 둘재 아이도 그러하였다. 셋재 아이도 그러하였다. 텁수룩한 머리털 시커먼 얼굴에 눈물 고인 충혈(充血)된 눈, 색(色)잃어 푸르스럼한 입술, 너들너들한 남루(襤褸), 찢겨진 맨발, 아아 얼마나 무서운 가난이 이 어린 소년(少年)들을 삼키였느냐! 나는 측은(惻隱)한 마음이 움직이였다. 나는 호주머니를 뒤지었다. 두툼한 지갑, 시계(時計), 손수건, …… 있을 것은 죄다 있었다.",트루게네프의 언덕,윤동주
kpoem_0482,그러나 무턱대고 이것들을 내줄 용기(勇氣)는 없었다. 손으로 만지작 만지작 거릴뿐이었다. 다정(多情)스레 이야기나 하리라하고 「얘들아」 불러보았다. 첫재 아이가 충혈(充血)된 눈으로 흘끔 돌아다 볼뿐이었다. 둘째아이도 그러할 뿐이었다. 셋째아이도 그러할뿐이었다. 그리고는 너는 상관(相關)없다는듯이 자기(自己)네 끼리 소근소근 이야기하면서 고개로 넘어 갔다. 언덕우에는 아무도 없었다. 짙어가는 황혼(黃昏)이 밀려들뿐,트루게네프의 언덕,윤동주
kpoem_0483,"여기저기서 단풍잎 같은 슬픈 가을이 뚝뚝 떨어진다. 단풍잎 떨어져 나온 자리마다 봄을 마련해 놓고 나뭇가지 우에 하늘이 펼쳐 있다. 가만히 하늘을 들여다보려면 눈썹에 파란 물감이 든다. 두 손으로 따뜻한 볼을 쓸어보면 손바닥에도 파란 물감이 묻어난다. 다시 손바닥을 들여다본다. 손금에는 맑은 강물이 흐르고, 맑은 강물이 흐르고, 강물 속에는 사랑처럼 슬픈 얼굴----아름다운 순이(順伊)의 얼굴이 어린다. 소년은 황홀히 눈을 감아 본다. 그래도 맑은 강물은 흘러 사랑처럼 슬픈 얼굴-----아름다운 순이(順伊)의 얼굴은 어린다.",소년,윤동주
kpoem_0484,"순이(順伊)가 떠난다는 아침에 말 못할 마음으로 함박눈이 내려, 슬픈 것처럼 창 밖에 아득히 깔린 지도 위에 덮인다. 방 안을 돌아다 보아야 아무도 없다. 벽과 천정이 하얗다. 방 안에까지 눈이 내리는 것일까, 정말 너는 잃어버린 역사처럼 홀홀이 가는 것이냐. 떠나기 전에 일러둘 말이 있던 것을 편지를 써서도 네가 가는 곳을 몰라 어느 거리, 어느 마을, 어느 지붕 밑, 너는 내 마음 속에만 남아 있는 것이냐. 네 쪼그만 발자욱을 눈이 자꾸 내려 덮어 따라갈 수도 없다. 눈이 녹으면 남은 발자욱 자리마다 꽃이 피리니 꽃 사이로 발자욱을 찾아 나서면 일년 열두달 하냥 내 마음에는 눈이 내리리라.",눈 오는 지도,윤동주
kpoem_0485,"시퍼렇게 흘러내리는 노들 강, 나뭇가지를 후려 꺾는 눈보라와 함께 얼어붙어 삼동 긴 겨울에 그것은 살결 센 손등처럼 몇 번 터지고 갈라지며, 또 그 위에 밀물이 넘쳐 얼음은 두 자 석 자 두터워졌다. 봄! 부드러운 바람결 옷깃으로 기어들 제, 얼음판은 풀리고 녹아서, 돈짝 구들장 같은 조각이 되어 황해바다로 흘러간다.",세월,임화
kpoem_0486,"이렇게 때는 흐르고 흘러서, 넓은 산 모서리를 스쳐내리고, 굳은 바위를 깎아, 천리 길 노들 강의 하상을 깔아놓았나니, 세월이여! 흐르는 영원의 것이여! 모든 것을 쌓아 올리고, 모든 것을 허물어 내리는, 오오 흐르는 시간이여, 과거이고 미래인 것이여! 우리들은 이 붉은 산을, 시커먼 바위를, 그리고 흐르는 세월을, 닥쳐오는 미래를, 존엄보다도 그것을 사랑한다. 몸과 마음, 그 밖에 있는 모든 것을 다하여……. 세월이여, 너는 꿈에도 한번 사멸하는 것이 그 길에서 돌아서는 것을 허락한 일이 없고, 과거의 망령이 생탄하는 어린것의 울음 우는 목을 누르게 한 일은 없었다. 너는 언제나 얼음장 같이 냉혹한 품안에 이 모든 것의 차례를 바꿈 없이 담뿍 기르며 흘러 왔다.",세월,임화
kpoem_0487,"우리들은 타는 가슴을 흥분에 두근거리면서 젊은 시대의 대오는 뜨거운 맥이 높이 뛰는 두 손을 쩍 벌리고, 모든 것을 그 아름에 끼고 닥쳐오는 세월! 미래! 그대를 이 지상에 굳건히 부여잡는다. 우리는 역사의 현실이 물결치는 대하 가운데서 썩어지며 무너져가는 그것을 물리칠 확고한 계획과 그것을 향해 갈 독수리와 같이 돌진할 만신의 용기를 가지고, 이 너른 지상의 모든 곳에서 너의 품안으로 다가선다. 오오, 사랑하는 영원한 청춘 세월이여. 너의 그 아름다운 커다란 푸른빛 눈을 크게 뜨고, 오오, 대지의 세계를 둘러보라! 누구가 정말 너의 계획의 계획자이며! 누구가 정말 너의 의지의 실행자인가?",세월,임화
kpoem_0488,"오오, 한 초 한 분 온 세계 위에 긴 날개를 펼치고 날아드는 한 해여! 우리는 너에게 온 세계를 요구한다. 낡은 것과 새로운 것의 불 닿는 말썽 가운데서 좋은 것을, 더 좋은 것을. …… 오오! 감히 어떤 바람이 있어, 어떤 힘이 있어, 물결이여, 돌아서라! 하상이여, 일어나라! 고 손질할 것이며, 세월이여, 퇴거하라! 미래여, 물러가거라! 고 소리치겠는가? 미래여! 사랑하는 영원이여! 세계의 모든 것과 함께 너는 영원히 젊은 우리들의 것이다.",세월,임화
kpoem_0489,"젊었을 그 때엔 저렇듯 아름다운 꽃 이파리도, 이곳엔 꿈인 듯 흩어져 버리고, 천년의 긴 목숨을 하늘 높이 자랑하든 저 아름드리 솔 잣나무의 높고 큰 줄기도 역시 이곳에는 허리를 꺾고 넘어지나니, 이 모든 것의 위에를 마음대로 오르고 내리는 온갖 새의 임금인 독수리여! 너도 역시 마지막엔 그 크고 넓은 두 날갯죽지를 흐늘어뜨리고, 저무는 가을 날 초라한 나뭇잎새 바람에 나부껴 흩날리듯 옛 그날이 있는 듯 만 듯 덧없이 한줌 흙으로 돌아가고 마는가? 노한 구름이 비바람 뿌리며 소리치던 그 험한 날 천리 먼 길에도, 일찍이 날개를 접어 굴욕(屈辱)의 숲속에서 부끄러운 눈알을 한번도 두려움에 굴려본 기억이 없는 오오! 하늘의 영웅이여! 너도 주검이 한번 네 큰 몸을 번쩍 들어 땅 위에 메다치면 비록 어지러운 가슴을 누를 수 없는 노함과 원한에 깨칠지언정, 날개를 펼쳐 다시 한 번 이곳에서 하늘을 향하여 화살처럼 내닫지는 못했는가?",주리라 네 탐내는 모든 것을,임화
kpoem_0490,"오오! 말 없는 악령(惡靈)이여! 모든 것의 무덤인 대지여! 너는 말하지 못하겠는가? 정말로 너는 목숨 있는 모든 것을 주검으로 거두는, 살아있고 살아가는 모든 것의 최후의 원수인지…… 너는 대답지 못하겠는가? 천고의 옛날과 같이 지금도 또 끝없을 먼 미래에까지 너는 역시 말 없는 짐승이 되어 이곳에 엎뎌져 있겠는가? 높은 산악이여! 굳은 암석이여! 끝없는 바다까지도 네 품에 안고 있는 무한한 담묵과 암흑의 군주여! 만일 네 넓고 푸른 대양이나 호수의 눈과 같이 언제나 뜨고서도 보지를 못한다면, 이 한 몸 둥그런 돌멩이 만들어 영원히 감지 않는 네 속에 풍덩 뛰어 들리라. 만일 네 누르고 푸른 가죽이나 검고 굳은 바위처럼 아무것도 감지할 수 없다면은, 사랑하는 어머님 젖가슴 뜯으며 어리광 부리던, 이 두 손으로 네 위에 더운 피 흐르도록 두드리리라.",주리라 네 탐내는 모든 것을,임화
kpoem_0491,"만일 네 아늑한 산맥의 귓전이 하늘을 찢는 우뢰(雨雷)소리조차 들을 수 없다면, 못 잊을 임 볼 밑에서 뜨거운 마음을 하소연 하던, 이 다문 입을열어 입술이 불되도록 절규하리라. 만일 네 깊은 심장이 어둠과 침묵 밖에는 아무것도 알기를 싫어한다면, 두 손과 다리를 가슴에 한데 모아 운석(隕石)이 되어 네 위에 떨어지리라. 그래도 만일 네 영원히 침묵의 제왕으로 주검밖에 아무것도 알지를 못한다면, 주리라! 오오, 네 탐내는 모든 것을…… 너의 멀고 넓은 태평양 바다의 한옆 아늑한 내해 가운데 한 오리 내어민 반도 동쪽 가, 성천강(城川江) 물줄기 맑게 흐르는 남쪽 기슭인 네 한길 품속에 영원히 잠든 내 사랑하는 벗 그가 네게 내어준 그것과 같이 심장 두 팔 두 다리, 도 그 위를 뛰고 달리며 일찍이 어떠한 두려움에도 허리를 굽히지 않았던 청년의 이 온몸을…… 너는 탐내는가? 말해보라! 그렇지 않으면 그것으로도 아직 네 탐욕의 목마름은 나을 수가 없겠는가?",주리라 네 탐내는 모든 것을,임화
