doc_id,text,title,poet
kpoem_0312,비는 가장 큰 권위(權威)를 가지고 가장 좋은 기회(機會)를 줍니다 비는 해를 가리고 하늘을 가리고 세상 사람들의 눈을 가립니다 그러나 비는 번개와 무지개를 가리지 않습니다 나는 번개가 되어 무지개를 타고 당신에게 가서 사랑의 팔에 감기고자 합니다 비오는 날 가만히 가서 당신의 침묵(沈黙)을 가져온대도 당신의 주인(主人)은 알 수가 없습니다 만일 당신이 비오는 날에 오신다면 나는 연잎(蓮葉)으로 윗옷을 지어서 보내겠습니다 당신이 비오는 날에 연잎(蓮葉) 옷을 입고 오시면 이 세상에는 알 사람이 없습니다 당신이 비 가운대로 가만히 오셔서 나의 눈물을 가져 가신대도 영원(永遠)한 비밀(秘密)이 될 것입니다 비는 가장 큰 권위(權威)를 가지고 가장 좋은 기회(機會)를 줍니다,비,한용운
kpoem_0313,나는 당신을 이별하지 아니할 수가 없습니다 님이여 나의 이별을 참아 주셔요 당신은 고개를 넘어갈 때에 나를 돌아보지 마셔요 나의 몸은 한 작은 모래 속으로 들어가려 합니다 님이여 이별을 참을 수가 없거든 나의 죽음을 참아 주셔요 나의 생명(生命)의 배는 부끄러움의 땀의 바다에서 스스로 폭침(爆沈)하려 합니다 님이여 님의 입김으로 그것을 불어서 속히 잠기게 하여 주셔요 그리고 그것을 웃어 주셔요 님이여 나의 죽음을 참을 수가 없거든 나를 사랑하지 말아 주셔요 그리하고 나로 하여금 당신을 사랑할 수가 없도록 하여 주셔요 나의 몸은 터럭 하나도 빼지 아니한 채로 당신의 품에 사라지겠습니다 님이여 당신과 내가 사랑의 속에서 하나가 되는 것을 참아 주셔요 그리하여 당신은 나를 사랑하지 말고 나로 하여금 당신을 사랑할 수가 없도록 하여 주셔요 오오 님이여,참아 주셔요,한용운
kpoem_0314,엷은 사(紗)의 장막(帳幕)이 작은 바람에 휘둘려서 처녀(處女)의 꿈을 휩싸듯이 자취도 없는 당신의 사랑은 나의 청춘(靑春)을 휘감습니다 발딱거리는 어린 피는 고요하고 맑은 천국(天國)의 음악(音樂)에 춤을 추고 헐떡이는 작은 영(靈)은 소리 없이 떨어지는 천화(天花)의 그늘에 잠이 듭니다 가는 봄비가 드린 버들에 둘려서 푸른 연기가 되듯이 끝도 없는 당신의 정실(情實)이 나의 잠을 얼급니다 바람을 따라가려는 짧은 꿈은 이불 안에서 몸부림치고 강 건너 사람을 부르는 바쁜 잠꼬대는 목 안에서 그네를 뜁니다 비낀 달빛이 이슬에 젖은 꽃수풀을 싸라기처럼 부시듯이 당신의 떠난 한(恨)은 드는 칼이 되어서 나의 애를 토막토막 끊어 놓았습니다 문밖의 시내물은 물결을 보태려고 나의 눈물을 받으면서 흐르지 않습니다 봄동산의 미친 바람은 꽃 떨어뜨리는 힘을 더하려고 나의 한숨을 기다리고 섰습니다,어느것이 참이냐,한용운
kpoem_0315,마셔요 제발 마셔요 보면서 못 보는 체 마셔요 마셔요 제발 마셔요 입술을 다물고 눈으로 말하지 마셔요 마셔요 제발 마셔요 뜨거운 사랑에 웃으면서 차디찬 잔부끄러움에 울지 마셔요 마셔요 제발 마셔요 세계(世界)의 꽃을 혼자 따면서 항분(亢奮)에 넘쳐서 떨지 마셔요 마셔요 제발 마셔요 미소(微笑)는 나의 운명(運命)의 가슴에서 춤을 춥니다 새삼스럽게 스스러워 마셔요,첫 키스,한용운
kpoem_0316,나는 선사(禪師)의 설법(說法)을 들었습니다 「너는 사랑의 쇠사슬에 묶여서 고통(苦痛)을 받지 말고 사랑의 줄을 끊어라 그러면 너의 마음이 즐거우리라」고 선사(禪師)는 큰 소리로 말하였습니다 그 선사(禪師)는 어지간히 어리석습니다 사랑의 줄에 묶이는 것이 아프기는 아프지만 사랑의 줄을 끊으면 죽는 것보다도 더 아픈 줄을 모르는 말입니다 사랑의 속박(束縛)은 단단히 얽어매는 것이 풀어주는 것입니다 그러므로 대해탈(大解脫)은 속박(束縛)에서 얻는 것입니다 님이여 나를 얽은 님의 사랑의 줄이 약할까 봐서 나의 님을 사랑하는 줄을 곱드렸습니다,선사의 설법,한용운
kpoem_0317,뜰 앞에 버들을 심어 님의 말을 매렸더니 님은 가실 때에 버들을 꺾어 말채찍을 하였습니다 버들마다 채찍이 되어서 님을 따르는 나의 말도 채칠까 하였더니 남은 가지 천만사(千萬絲)는 해마다 해마다 보낸 한(恨)을 잡아맵니다,심은 버들,한용운
kpoem_0318,"죽은 줄 알았던 매화나무 가지에 구슬 같은 꽃방울을 맺혀 주는 쇠잔한 눈 위에 가만히 오는 봄 기운은 아름답기도 합니다 그러나 그밖에 다른 하늘에서 오는 알 수 없는 향기는, 모든 꽃의 죽음을 가지고 다니는 쇠잔한 눈이 주는 줄을 아십니까 구름은 가늘고 시내물은 옅고 가을 산은 비었는데 파리한 바위 사이에 실컷 붉은 단풍은 곱기도 합니다 그러나 단풍은 노래도 부르고 울음도 웁니다 그러한 「자연(自然)의 인생(人生)」은, 가을 바람의 꿈을 따라 사라지고 기억(記憶)에만 남아 있는 지난 여름의 무르녹은 녹음(綠陰)이 주는 줄을 아십니까 일경초(一莖草)가 장육금신(丈六金身)이 되고 장육금신(丈六金身)이 일경초(一莖草)가 됩니다 천지(天地)는 한 보금자리요 만유(萬有)는 같은 소조(小鳥)입니다 나는 자연(自然)의 거울에 인생(人生)을 비춰보았습니다 고통(苦痛)의 가시덤불 뒤에 환희(歡喜)의 낙원(樂園)을 건설하기 위하여 님을 떠난 나는 아아 행복(幸福)입니다",낙원은 가시덤풀에서,한용운
kpoem_0319,그것이 참말인가요 님이여 속임없이 말씀하여 주셔요 당신을 나에게서 빼앗아 간 사람들이 당신을 보고 「그대는 님이 없다」고 하였다지요 그래서 당신은 남 모르는 곳에서 울다가 남이 보면 울음을 웃음으로 변한다지요 사람의 우는 것은 견딜 수가 없는 것인데 울기조차 마음대로 못하고 웃음으로 변하는 것은 죽음의 맛보다도 더 쓴 것입니다 그러면 나는 그것을 변명하지 않고는 견딜 수가 없습니다 나의 생명의(生命) 꽃가지를 있는대로 꺾어서 화환(花環)을 만들어 당신의 목에 걸고 「이것이 님의 님이라」고 소리쳐 말하겠습니다 그것이 참말인가요 님이여 속임없이 말씀하여 주셔요 당신을 나에게서 빼앗아 간 사람들이 당신을 보고 「그대의 님은 우리가 구하여준다」고 하였다지요 그래서 당신은 「독신생활(獨身生活)을 하겠다」고 하였다지요 그러면 나는 그들에게 분풀이를 하지 않고는 견딜 수가 없습니다 많지 않은 나의 피를 더운 눈물에 섞어서 피에 목마른 그들의 칼에 뿌리고 「이것이 님의 님이라」고 울음 섞어서 말하겠습니다,참말인가요,한용운
kpoem_0320,당신의 편지가 왔다기에 꽃밭 매던 호미를 놓고 떼어 보았습니다 그 편지는 글씨는 가늘고 글줄은 많으나 사연은 간단합니다 만일 님이 쓰신 편지이면 글은 짧을지라도 사연은 길 터인데 당신의 편지가 왔다기에 바느질그릇을 치워놓고 떼어 보았습니다 그 편지는 나에게 잘 있느냐고만 묻고 언제 오신다는 말은 조금도 없습니다 만일 님이 쓰신 편지이면 나의 일은 묻지 않더라도 언제 오신다는 말을 먼저 썼을 터인데 당신의 편지가 왔다기에 약을 달이다 말고 떼어 보았습니다 그 편지는 당신의 주소(住所)는 다른 나라의 군함(軍艦)입니다 만일 님이 쓰신 편지이면 남의 군함(軍艦)에 있는 것이 사실이라 할지라도 편지에는 군함(軍艦)에서 떠났다고 하였을 터인데,당신의 편지,한용운
kpoem_0321,당신은 옛 맹세(盟誓)를 깨치고 가십니다 당신의 맹세(盟誓)는 얼마나 참되었습니까 그 맹세(盟誓)를 깨치고 가는 이별은 믿을 수가 없습니다 참 맹세(盟誓)를 깨치고 가는 이별은 옛 맹세(盟誓)로 돌아올 줄을 암니다 그것은 엄숙한 인과율(因果律)입니다 나는 당신과 떠날 때에 입맞춘 입술이 마르기 전에 당신이 돌아와서 다시 입맞추기를 기다립니다 그러나 당신이 가시는 것은 옛 맹세(盟誓)를 깨치려는 고의(故意)가 아닌 줄을 나는 암니다 비겨 당신이 지금의 이별을 영원히 깨치지 않는다 하여도 당신의 마지막 접촉(接觸)을 받은 나의 입술을 다른 남자(男子)의 입술에 대일 수는 없습니다,인과율,한용운
kpoem_0322,「사랑이라는 것은 다 무엇이냐 진정한 사람에게는 눈물도 없고 웃음도 없는 것이다 사랑의 뒤웅박을 발길로 차서 깨뜨려버리고 눈물과 웃음을 티끌 속에 합장(合葬)하여라 이치(理智)와 감정(感情)을 두드려 깨쳐서 가루를 만들어버려라 그리고 허무(虛無)의 절정(絶頂)에 올라가서 어지럽게 춤추고 미치게 노래하여라 그리고 애인(愛人)과 악마(惡魔)를 똑같이 술을 먹여라 그리고 천치(天癡)가 되던지 미치광이가 되던지 산송장이 되던지 하여버려라 그래 너는 죽어도 사랑이라는 것은 버릴 수가 없단 말이냐 그렇거든 사랑의 꽁문이에 도롱태를 달아라,잠꼬대,한용운
kpoem_0323,"그래서 네 멋대로 끌고 돌아다니다가 쉬고 싶거든 쉬고 자고 싶거든 자고 살고 싶거든 살고 죽고 싶거든 죽어라 사랑의 발바닥에 말목을 쳐놓고 붙들고 서서 엉엉 우는 것은 우스운 일이다 이 세상에는 이마빡에다 「님」이라고 새기고 다니는 사람은 하나도 없다 연애(戀愛)는 절대(絶對) 자유(自由)요 정조(貞操)는 유동(流動)이요 결혼식장(結婚式場)은 임간(林間)이다」 나는 잠결에 큰 소리로 이렇게 부르짖었다 아아,혹성(惑星) 같이 빛나는 님의 미소(微笑)는 검은 어둠(黑闇)의 광선(光線)에서 채 사라지지 아니하였습니다 잠의 나라에서 몸부림치던 사랑의 눈물은 어느덧 베개를 적셨습니다 용서(容恕)하셔요 님이여 아무리 잠이 지은 허물이라도 님이 벌(罰)을 주신다면 그 벌(罰)을 잠을 주기는 싫습니다",잠꼬대,한용운
kpoem_0324,세상에 만족(滿足)이 있느냐 인생(人生)에게 만족(滿足)이 있느냐 있다면 나에게도 있으리라 세상에 만족(滿足)이 있기는 있지마는 사람의 앞에만 있다 거리(距離)는 사람의 팔 길이와 같고 속력(速力)은 사람의 걸음과 비례(比例)가 된다 만족(滿足)은 잡을래야 잡을 수도 없고 버릴래야 버릴 수도 없다 만족(滿足)을 얻고 보면 얻은 것은 불만족(不滿足)이오 만족(滿足)은 여전히 앞에 있다 만족(滿足)은 우자(禹者)나 성자(聖者)의 주관적(主觀的) 소유(所有)가 아니면 약자(弱者)의 기대(期待)뿐이다 만족(滿足)은 언제든지 인생(人生)과 수직(竪的) 평행(平行)이다 나는 차라리 발꿈치를 돌려서 만족(滿足)의 묵은 자취를 밟을까 하노라 아아 나는 만족(滿足)을 얻었노라 아지랭이 같은 꿈과 금실(金實) 같은 환상(幻想)이 님 계신 꽃동산에 들릴 때에 아아 나는 만족(滿足)을 얻었노라,만족,한용운
kpoem_0325,아침에 일어나서 세수하려고 대야에 물을 떠다 놓으면 당신은 대야 안의 가는 물결이 되어 나의 얼굴 그림자를 불쌍한 아기처럼 얼러줍니다 근심을 잊을까 하고 꽃동산에 거닐 때에 당신은 꽃 사이를 스쳐오는 봄바람이 되어 시름없는 나의 마음에 꽃 향기를 묻혀 주고 갑니다 당신을 기다리다 못하여 잠자리에 누웠더니 당신은 고요한 어둠(黑闇)의 빛이 되어 나의 잔부끄러움을 살뜰이도 덮어 줍니다 어디라도 눈에 보이는 데마다 당신이 계시기에 눈을 감고 구름 위와 바다 밑을 찾아 보았습니다 당신은 미소(微笑)가 되어 나의 마음에 숨었다가 나의 감은 눈에 입 맞추고 「네가 나를 보느냐」고 조롱(嘲弄)합니다,어디라도,한용운
kpoem_0326,꽃은 떨어지는 향기가 아름답습니다 해는 지는 빛이 곱습니다 노래는 목맺힌 가락이 묘합니다 님은 떠날 때의 얼굴이 더욱 어여쁩니다 떠나신 뒤에 나의 환상(幻想)의 눈에 비치는 님의 얼굴은 눈물이 없는 눈으로는 바로 볼 수가 없을만치 어여쁠 것입니다 님의 떠날 때의 어여쁜 얼굴을 나의 눈에 새기겠습니다 님의 얼굴은 나를 울리기에는 너무도 야속한 듯 하지마는 님을 사랑하기 위하여는 나의 마음을 즐겁게 할 수가 없습니다 만일 그 어여쁜 얼굴이 영원히 나의 눈을 떠난다면 그때의 슬픔은 우는 것보다도 아프겠습니다,떠날 때의 님의 얼굴,한용운
kpoem_0327,맨처음에 만난 님과 님은 누구이며 어느 때인가요 맨처음에 이별한 님과 님은 누구이며 어느 때인가요 맨처음에 만난 님과 님이 맨처음으로 이별하였습니까 다른 님과 님이 맨처음으로 이별하였습니까 나는 맨처음에 만난 님과 님이 맨처음으로 이별한 줄로 암니다 만나고 이별이 없는 것은 님이 아니라 나입니다 이별하고 만나지 않는 것은 님이 아니라 길가는 사람입니다 우리들은 님에 대하여 만날 때에 이별을 염려하고 이별할 때에 만남을 기약합니다 그것은 맨처음에 만난 님과 님이 다시 이별한 유전성(遺傳性)의 흔적(痕跡)입니다 그러므로 만나지 않는 것도 님이 아니요 이별이 없는 것도 님이 아닙니다 님은 만날 때에 웃음을 주고 떠날 때에 눈물을 줍니다 만날 때의 웃음보다 떠날 때의 눈물이 좋고 떠날 때의 눈물보다 다시 만나는 웃음이 좋습니다 아아 님이여 우리의 다시 만나는 웃음은 어느 때에 있습니까,최초의 님,한용운
kpoem_0328,두견새는 실컷 운다 울다가 못다 울면 피를 흘려 운다 이별한 한(恨)이야 너뿐이랴마는 울래야 울지도 못하는 나는 두견새 못된 한(恨)을 또 다시 어찌하리 야속한 두견새는 돌아갈 곳도 없는 나를 보고도 「불여귀(不如歸) 불여귀(不如歸)」,두견새,한용운
kpoem_0329,꽃 핀 아침 달 밝은 저녁 비오는 밤 그때가 가장 님 그리운 때라고 남들은 말합니다 나도 같은 고요한 때로는 그때에 많이 울었습니다 그러나 나는 여러 사람이 모여서 말하고 노는 때에 더 울게 됩니다 님 있는 여러 사람들은 나를 위로하여 좋은 말을 합니다마는 나는 그들의 위로하는 말을 조소로 듣습니다 그때에는 울음을 삼켜서 눈물을 속으로 창자를 향하여 흘립니다,우는 때,한용운
kpoem_0330,벗이여 나의 벗이여 애인(愛人)의 무덤 위의 피어 있는 꽃처럼 나를 울리는 벗이여 작은 새의 자취도 없는 사막(沙漠)의 밤에 문득 만난 님처럼 나를 기쁘게 하는 벗이여 그대는 옛 무덤을 깨치고 하늘까지 사무치는 백골(白骨)의 향기(香氣)입니다 그대는 화환(花環)을 만들려고 떨어진 꽃을 줍다가 다른 가지에 걸려서 주운 꽃을 헤치고 부르는 절망(絕望)인 희망(希望)의 노래입니다 벗이여 깨어진 사랑에 우는 벗이여 눈물이 능히 떨어진 꽃을 옛 가지에 도로 피게 할 수는 없습니다 눈물을 떨어진 꽃에 뿌리지 말고 꽃나무 밑의 티끌에 뿌리셔요,타골의 시(GARDENISTO)를 읽고,한용운
kpoem_0331,벗이여 나의 벗이여 죽음의 향기(香氣)가 아무리 좋다 하여도 백골(白骨)의 입술에 입맞출 수는 없습니다 그의 무덤을 황금(黃金)의 노래로 그물치지 마셔요 무덤 위에 피 묻은 깃대(旗대)를 세우셔요 그러나 죽은 대지(大地)가 시인(詩人)의 노래를 거쳐서 움직이는 것을 봄바람은 말합니다 벗이여 부끄럽습니다 나는 그대의 노래를 들을 때에 어떻게 부끄럽고 떨리는지 모르겠습니다 그것은 내가 나의 님을 떠나서 홀로 그 노래를 듣은 까닭입니다,타골의 시(GARDENISTO)를 읽고,한용운
kpoem_0332,산천초목(山川草木)에 붙은 불은 수인씨(燧人氏)가 내셨습니다 청춘(靑春)의 음악(音樂)에 무도(舞蹈)하는 나의 가슴을 태우는 불은 가는 님이 내셨습니다 촉석루(矗石樓)를 안고 돌며 푸른 물결의 그윽한 품에 논개(論介)의 청춘(靑春)을 잠재우는 남강(南江)의 흐르는 물아 목단봉(牧丹峰)의 키스를 받고 계월향(桂月香)의 무정(無情)을 저주(咀呪)하면서 능라도(綾羅島)를 감돌아 흐르는 실연자(失戀者)인 대동강(大洞江)아 그대들의 권위(權威)로도 애태우는 불은 끄지 못할 줄을 번연히 알지마는 입버릇으로 불러 보았다,사랑의 불,한용운
kpoem_0333,만일 그대네가 쓰리고 아픈 슬픔으로 졸이다가 폭발(爆發)되는 가슴 가운데의 불을 끌 수가 있다면 그대들이 님 그리운 사람을 위하여 노래를 부를 때에 이따금이따금 목이 메어 소리를 이르지 못함은 무슨 까닭인가 남들이 볼 수 없는 그대네의 가슴 속에도 애태우는 불꽃이 거꾸로 타들어가는 것을 나는 본다 오오 님의 정열(情熱)의 눈물과 나의 감격(感激)의 눈물이 마주 닿아서 합류(合流)가 되는 때에 그 눈물의 첫 방울로 나의 가슴의 불을 끄고 그 다음 방울을 그대네의 가슴에 뿌려주리라,사랑의 불,한용운
kpoem_0334,당신의 얼굴은 봄 하늘의 고요한 별이어요 그러나 찢어진 구름 사이로 돋아오는 반달 같은 얼굴이 없는 것이 아닙니다 만일 어여쁜 얼굴만을 사랑한다면 왜 나의 베갯모에 달을 수 놓지 않고 별을 수 놓아요 당신의 마음은 티 없는 숫옥(數玉)이어요 그러나 곱기도 밝기도 굳기도 보석 같은 마음이 없는 것이 아닙니다 만일 아름다운 마음만을 사랑한다면 왜 나의 반지를 보석으로 아니하고 옥(玉)으로 만들어요 당신의 시(詩)는 봄비에 새로 눈뜨는 금결(金結) 같은 버들이어요 그러나 기름 같은 검은 바다에 피어오르는 백합꽃(百合花) 같은 시(詩)가 없는 것이 아닙니다 만일 좋은 문장(文章)만을 사랑한다면 왜 내가 꽃을 노래하지 않고 버들을 찬미(讚美)하여요 온세상 사람이 나를 사랑하지 아니할 때에 당신만이 나를 사랑하였습니다 나는 당신을 사랑하여요 나는 당신의 「사랑」을 사랑하여요,「사랑」을 사랑하여요,한용운
kpoem_0335,나는 잠자리에 누어서 자다가 깨고 깨다가 잘 때에 외로운 등잔불은 각근(恪勤)한 파수군(把守軍)처럼 온 밤을 지킵니다 당신이 나를 버리지 아니하면 나는 일생(一生)의 등잔불이 되어서 당신의 백년(百年)을 지키겠습니다 나는 책상 앞에 앉아서 여러 가지 글을 볼 때에 내가 요구(要求)만 하면 글은 좋은 이야기도 하고 맑은 노래도 부르고 엄숙한 교훈(敎訓)도 줍니다 당신이 나를 버리지 아니하면 나는 복종(服從)의 백과전서(百科全書)가 되어서 당신의 요구(要求)를 수응(酬應)하겠습니다 나는 거울을 대하여 당신의 키스를 기다리는 입술을 볼 때에 속임 없는 거울은 내가 웃으면 거울도 웃고 내가 찡그리면 거울도 찡그립니다 당신이 나를 버리지 아니하면 나는 마음의 거울이 되어서 속임 없이 당신의 고락(苦樂)을 같이하겠습니다,버리지 아니하면,한용운
kpoem_0336,가을 홍수(洪水)가 작은 시내의 쌓인 낙엽(落葉)을 휩쓸어가듯이 당신은 나의 환락(歡樂)의 마음을 빼앗아갔습니다 나에게 남은 마음은 고통(苦痛)뿐입니다 그러나 나는 당신을 원망할 수는 없습니다 당신이 가기 전에는 나의 고통(苦痛)의 마음을 빼앗아간 까닭입니다 만일 당신이 환락(歡樂)의 마음과 고통(苦痛)의 마음을 동시에 빼앗아간다 하면 나에게는 아무 마음도 없겠습니다 나는 하늘의 별이 되어서 구름의 면사(面紗)로 낯을 가리고 숨어 있겠습니다 나는 바다의 진주(眞珠)가 되었다가 당신의 구두에 단추가 되겠습니다 당신이 만일 별과 진주(眞珠)를 따서 게다가 마음을 넣어 다시 당신의 님을 만든다면 그때에는 환락(歡樂)의 마음을 넣어 주셔요 부득히 고통(苦痛)의 마음도 넣어야 하겠거든 당신의 고통(苦痛)을 빼어다가 넣어 주셔요 그리고 마음을 빼앗아 가는 요술(妖術)은 나에게는 가르쳐 주지 마셔요 그러면 지금의 이별이 사랑의 최후(最後)은 아닙니다,요술,한용운
kpoem_0337,당신이 계실 때에는 겨울밤이 짧더니 당신이 가신 뒤에는 여름밤이 길어요 책력(冊曆)의 내용(內容)이 그릇되었나 하였더니 개똥불이 흐르고 벌레가 웁니다 긴 밤은 어디서 오고 어디로 가는 줄을 분명히 알았습니다 긴 밤은 근심 바다의 첫 물결에서 나와서 슬픈 음악(音樂)이 되고 아득한 사막(沙漠)이 되더니 필경 절망(絶望)의 성(城) 너머로 가서 악마(惡魔)의 웃음 속으로 들어갑니다 그러나 당신이 오시면 나는 사랑의 칼을 가지고 긴 밤을 베혀서 일천(一千) 토막을 내겠습니다 당신이 계실 때에는 겨울밤이 짧더니 당신이 가신 뒤에는 여름밤이 길어요,여름밤이 길어요,한용운
kpoem_0338,「차라리 님이 없이 스스로 님이 되고 살지언정 하늘 위의 직녀성(織女星)은 되지 않겠어요 녜 녜」 나는 언제인지 님의 눈을 쳐다보며 조금 아양스런 소리로 이렇게 말하였습니다 이 말은 견우(牽牛)의 님을 그리는 직녀(織女)가 일년(一年)에 한번씩 만나는 칠석(七夕)을 어찌 기다리나 하는 동정(同情)의 저주(咀呪)였습니다 이 말에는 나는 모란꽃에 취한 나비처럼 일생(一生)을 님의 키스에 바쁘게 지나겠다는 교만한 맹세(盟誓)가 숨어 있습니다 아아 알 수 없는 것은 운명(運命)이요 지키기 어려운 것은 맹세(盟誓)입니다 나의 머리가 당신의 팔 위에 도리질을 한 지가 칠석(七夕)을 열 번이나 지나고 또 몇 번을 지내었습니다 그러나 그들은 나를 용서하고 불쌍히 여길 뿐이요 무슨 복수적(復讎的) 저주(詛呪)를 아니하였습니다 그들은 밤마다밤마다 은하수(銀河水)를 사이에 두고 마주 건너다보며 이야기하고 놉니다 그들은 헤죽헤죽 웃는 은하수(銀河水)의 강안(江岸)에서 물을 한줌씩 쥐어서 서로 던지고 다시 뉘우쳐 합니다,칠석,한용운
kpoem_0339,그들은 물에다 발을 잠그고 반비슷이 누어서 서로 안 보는 체하고 무슨 노래를 부릅니다 그들은 갈잎으로 배를 만들고 그 배에다 무슨 글을 써서 물에 띄우고 입김으로 불어서 서로 보냅니다 그리고 서로 글을 보고 이해(理解)하지 못하는 것처럼 잠자코 있습니다 그들은 돌아갈 때에는 서로 보고 웃기만 하고 아무 말도 아니합니다 지금은 칠월칠석(七月七夕)날 밤입니다 그들은 난초(蘭草)실로 주름을 접은 연꽃(蓮花)의 윗옷을 입었습니다 그들은 한 구슬에 일곱 빛나는 계수(桂樹)나무 열매의 노리개를 찻습니다 키스의 술에 취(醉)할 것을 상상(想像)하는 그들의 뺨은 먼저 기쁨을 못 이기는 자기(自己)의 열정(熱情)에 취(醉)하여 반이나 붉었습니다,칠석,한용운
kpoem_0340,그들은 오작교(烏鵲橋)를 건너갈 때에 걸음을 멈추고 윗옷의 뒷자락을 검사(檢査)합니다 그들은 오작교(烏鵲橋)를 건너서 서로 포옹(抱擁)하는 동안에 눈물과 웃음이 순서(順序)를 잃더니 다시금 공경(恭敬)하는 얼굴을 보입니다 아아 알수 없는 것은 운명(運命)이요 지키기 어려운 것은 맹세(盟誓)입니다 나는 그들의 사랑이 표현(表現)인 것을 보았습니다 진정한 사랑은 표현(表現)할 수가 없습니다 그들은 나의 사랑을 볼 수는 없습니다 사랑의 신성(神聖)은 표현에 있지 않고 비밀(秘密)에 있습니다 그들이 나를 하늘로 오라고 손짓을 한대도 나는 가지 않겠습니다 지금은 칠월칠석(七月七夕)날 밤입니다,칠석,한용운
